{
  "dimension": "minecraft:overworld",
  "playable_range": {
    "min_y": 100,
    "max_y": 200,
    "distribution": "uniform"
  },
  "surface_anchor": {
    "type": "isekai_api:fixed_y",
    "y": 150
  },
  "ore_strategy": {
    "type": "isekai_api:linear"
  },
  "structure_strategy": {
    "type": "isekai_api:linear"
  },
  "mob_spawn_strategy": {
    "type": "isekai_api:linear"
  },
  "default_structure_predicate": {
    "type": "isekai_api:y_in_range",
    "min": 100,
    "max": 200
  }
}
