{
  "dimension": "minecraft:overworld",
  "playable_range": {
    "min_y": -64,
    "max_y": 40,
    "distribution": "biased_low"
  },
  "surface_anchor": {
    "type": "isekai_api:fixed_y",
    "y": 30
  },
  "ore_strategy": {
    "type": "isekai_api:pipe",
    "chain": [
      { "type": "isekai_api:inverted" },
      { "type": "isekai_api:linear" }
    ]
  },
  "structure_strategy": {
    "type": "isekai_api:linear"
  },
  "mob_spawn_strategy": {
    "type": "isekai_api:count_scale",
    "factor": 1.5
  },
  "default_structure_predicate": {
    "type": "isekai_api:and",
    "all": [
      { "type": "isekai_api:y_in_range", "min": -64, "max": 40 },
      { "type": "isekai_api:solid_ceiling", "min_clearance": 3 }
    ]
  },
  "priority": 110
}
