{
  "dimension": "minecraft:overworld",
  "playable_range": { "min_y": 40, "max_y": 240, "distribution": "uniform" },
  "surface_anchor": { "type": "isekai_api:fixed_y", "y": 140 },
  "ore_strategy":       { "type": "isekai_api:linear" },
  "structure_strategy": { "type": "isekai_api:identity" },
  "mob_spawn_strategy": { "type": "isekai_api:identity" },
  "default_structure_predicate": {
    "type": "isekai_api:and",
    "all": [
      { "type": "isekai_api:y_in_range", "min": 50, "max": 230 },
      { "type": "isekai_api:solid_floor", "min_clearance": 2 }
    ]
  },
  "structure_predicates": {
    "minecraft:monument":           { "type": "isekai_api:never" },
    "minecraft:shipwreck":          { "type": "isekai_api:never" },
    "minecraft:shipwreck_beached":  { "type": "isekai_api:never" },
    "minecraft:buried_treasure":    { "type": "isekai_api:never" },
    "minecraft:ocean_ruin_cold":    { "type": "isekai_api:never" },
    "minecraft:ocean_ruin_warm":    { "type": "isekai_api:never" },
    "minecraft:ancient_city":       { "type": "isekai_api:never" }
  },
  "applies_to": [
    "minecraft:plains", "minecraft:sunflower_plains",
    "minecraft:snowy_plains", "minecraft:ice_spikes",
    "minecraft:desert", "minecraft:savanna", "minecraft:savanna_plateau", "minecraft:windswept_savanna",
    "minecraft:forest", "minecraft:flower_forest", "minecraft:birch_forest",
    "minecraft:old_growth_birch_forest", "minecraft:dark_forest",
    "minecraft:taiga", "minecraft:snowy_taiga",
    "minecraft:old_growth_pine_taiga", "minecraft:old_growth_spruce_taiga",
    "minecraft:jungle", "minecraft:sparse_jungle", "minecraft:bamboo_jungle",
    "minecraft:swamp", "minecraft:mangrove_swamp",
    "minecraft:meadow", "minecraft:cherry_grove",
    "minecraft:grove", "minecraft:snowy_slopes",
    "minecraft:frozen_peaks", "minecraft:jagged_peaks", "minecraft:stony_peaks",
    "minecraft:windswept_hills", "minecraft:windswept_gravelly_hills", "minecraft:windswept_forest",
    "minecraft:beach", "minecraft:snowy_beach", "minecraft:stony_shore",
    "minecraft:mushroom_fields"
  ],
  "exclusions": {
    "carvers": [
      "minecraft:cave", "minecraft:cave_extra_underground",
      "minecraft:canyon", "minecraft:nether_cave"
    ],
    "features": [
      "minecraft:spring_water", "minecraft:spring_lava", "minecraft:spring_lava_frozen",
      "minecraft:spring_open", "minecraft:spring_closed",
      "minecraft:spring_closed_double", "minecraft:spring_delta"
    ]
  },
  "atmosphere": {
    "sky_color": 9419271,
    "fog_color": 13415129
  },
  "content_overrides": {
    "feature_predicates": {
      "minecraft:lake_lava_surface": { "type": "isekai_api:solid_floor", "min_clearance": 3 }
    }
  },
  "priority": 100
}
