{
  "dimension": "isekai_verify:surface_override",
  "playable_range": { "min_y": -64, "max_y": 320, "distribution": "uniform" },
  "surface_anchor": { "type": "isekai_api:world_surface" },
  "ore_strategy": { "type": "isekai_api:identity" },
  "structure_strategy": { "type": "isekai_api:identity" },
  "mob_spawn_strategy": { "type": "isekai_api:identity" },
  "default_structure_predicate": { "type": "isekai_api:always" },
  "applies_to": { "keys": ["minecraft:plains"] },
  "content_overrides": {
    "block_overrides": {
      "surface_top": {
        "minecraft:plains": { "Name": "minecraft:red_concrete" }
      },
      "default_block": {
        "minecraft:plains": { "Name": "minecraft:diorite" }
      }
    }
  },
  "priority": 100
}
