{
  "dimension": "minecraft:overworld",
  "playable_range": { "min_y": 0, "max_y": 300, "distribution": "uniform" },
  "surface_anchor": { "type": "isekai_api:world_surface" },
  "ore_strategy": { "type": "isekai_api:linear" },
  "structure_strategy": { "type": "isekai_api:identity" },
  "mob_spawn_strategy": { "type": "isekai_api:identity" },
  "default_structure_predicate": { "type": "isekai_api:always" }
}
